No.     Time                          Source                Destination           Protocol Length Info
     52 2017-04-12 10:04:27.680661    127.0.0.1             127.0.0.1             TCP      68     49813 → 4296 [SYN] Seq=0 Win=65535 Len=0 MSS=16344 WS=32 TSval=680987802 TSecr=0 SACK_PERM=1

Frame 52: 68 bytes on wire (544 bits), 68 bytes captured (544 bits) on interface 0
    Interface id: 0 (lo0)
    Encapsulation type: NULL/Loopback (15)
    Arrival Time: Apr 12, 2017 10:04:27.680661000 CEST
    [Time shift for this packet: 0.000000000 seconds]
    Epoch Time: 1491984267.680661000 seconds
    [Time delta from previous captured frame: 21.826710000 seconds]
    [Time delta from previous displayed frame: 21.826710000 seconds]
    [Time since reference or first frame: 96.129965000 seconds]
    Frame Number: 52
    Frame Length: 68 bytes (544 bits)
    Capture Length: 68 bytes (544 bits)
    [Frame is marked: True]
    [Frame is ignored: False]
    [Protocols in frame: null:ip:tcp]
    [Coloring Rule Name: TCP SYN/FIN]
    [Coloring Rule String: tcp.flags & 0x02 || tcp.flags.fin == 1]
Null/Loopback
    Family: IP (2)
Internet Protocol Version 4, Src: 127.0.0.1, Dst: 127.0.0.1
    0100 .... = Version: 4
    .... 0101 = Header Length: 20 bytes (5)
    Differentiated Services Field: 0x00 (DSCP: CS0, ECN: Not-ECT)
        0000 00.. = Differentiated Services Codepoint: Default (0)
        .... ..00 = Explicit Congestion Notification: Not ECN-Capable Transport (0)
    Total Length: 64
    Identification: 0x9737 (38711)
    Flags: 0x02 (Don't Fragment)
        0... .... = Reserved bit: Not set
        .1.. .... = Don't fragment: Set
        ..0. .... = More fragments: Not set
    Fragment offset: 0
    Time to live: 64
    Protocol: TCP (6)
    Header checksum: 0x0000 [validation disabled]
    [Header checksum status: Unverified]
    Source: 127.0.0.1
    Destination: 127.0.0.1
    [Source GeoIP: Unknown]
    [Destination GeoIP: Unknown]
Transmission Control Protocol, Src Port: 49813, Dst Port: 4296, Seq: 0, Len: 0
    Source Port: 49813
    Destination Port: 4296
    [Stream index: 3]
    [TCP Segment Len: 0]
    Sequence number: 0    (relative sequence number)
    Acknowledgment number: 0
    Header Length: 44 bytes
    Flags: 0x002 (SYN)
        000. .... .... = Reserved: Not set
        ...0 .... .... = Nonce: Not set
        .... 0... .... = Congestion Window Reduced (CWR): Not set
        .... .0.. .... = ECN-Echo: Not set
        .... ..0. .... = Urgent: Not set
        .... ...0 .... = Acknowledgment: Not set
        .... .... 0... = Push: Not set
        .... .... .0.. = Reset: Not set
        .... .... ..1. = Syn: Set
            [Expert Info (Chat/Sequence): Connection establish request (SYN): server port 4296]
                [Connection establish request (SYN): server port 4296]
                [Severity level: Chat]
                [Group: Sequence]
        .... .... ...0 = Fin: Not set
        [TCP Flags: ··········S·]
    Window size value: 65535
    [Calculated window size: 65535]
    Checksum: 0xfe34 [unverified]
    [Checksum Status: Unverified]
    Urgent pointer: 0
    Options: (24 bytes), Maximum segment size, No-Operation (NOP), Window scale, No-Operation (NOP), No-Operation (NOP), Timestamps, SACK permitted, End of Option List (EOL)
        Maximum segment size: 16344 bytes
            Kind: Maximum Segment Size (2)
            Length: 4
            MSS Value: 16344
        No-Operation (NOP)
            Type: 1
                0... .... = Copy on fragmentation: No
                .00. .... = Class: Control (0)
                ...0 0001 = Number: No-Operation (NOP) (1)
        Window scale: 5 (multiply by 32)
            Kind: Window Scale (3)
            Length: 3
            Shift count: 5
            [Multiplier: 32]
        No-Operation (NOP)
            Type: 1
                0... .... = Copy on fragmentation: No
                .00. .... = Class: Control (0)
                ...0 0001 = Number: No-Operation (NOP) (1)
        No-Operation (NOP)
            Type: 1
                0... .... = Copy on fragmentation: No
                .00. .... = Class: Control (0)
                ...0 0001 = Number: No-Operation (NOP) (1)
        Timestamps: TSval 680987802, TSecr 0
            Kind: Time Stamp Option (8)
            Length: 10
            Timestamp value: 680987802
            Timestamp echo reply: 0
        TCP SACK Permitted Option: True
            Kind: SACK Permitted (4)
            Length: 2
        End of Option List (EOL)
            Type: 0
                0... .... = Copy on fragmentation: No
                .00. .... = Class: Control (0)
                ...0 0000 = Number: End of Option List (EOL) (0)

0000  02 00 00 00 45 00 00 40 97 37 40 00 40 06 00 00   ....E..@.7@.@...
0010  7f 00 00 01 7f 00 00 01 c2 95 10 c8 a7 4d 11 14   .............M..
0020  00 00 00 00 b0 02 ff ff fe 34 00 00 02 04 3f d8   .........4....?.
0030  01 03 03 05 01 01 08 0a 28 97 0c 9a 00 00 00 00   ........(.......
0040  04 02 00 00                                       ....

No.     Time                          Source                Destination           Protocol Length Info
     53 2017-04-12 10:04:27.680818    127.0.0.1             127.0.0.1             TCP      68     4296 → 49813 [SYN, ACK] Seq=0 Ack=1 Win=65535 Len=0 MSS=16344 WS=32 TSval=680987802 TSecr=680987802 SACK_PERM=1

Frame 53: 68 bytes on wire (544 bits), 68 bytes captured (544 bits) on interface 0
    Interface id: 0 (lo0)
    Encapsulation type: NULL/Loopback (15)
    Arrival Time: Apr 12, 2017 10:04:27.680818000 CEST
    [Time shift for this packet: 0.000000000 seconds]
    Epoch Time: 1491984267.680818000 seconds
    [Time delta from previous captured frame: 0.000157000 seconds]
    [Time delta from previous displayed frame: 0.000157000 seconds]
    [Time since reference or first frame: 96.130122000 seconds]
    Frame Number: 53
    Frame Length: 68 bytes (544 bits)
    Capture Length: 68 bytes (544 bits)
    [Frame is marked: True]
    [Frame is ignored: False]
    [Protocols in frame: null:ip:tcp]
    [Coloring Rule Name: TCP SYN/FIN]
    [Coloring Rule String: tcp.flags & 0x02 || tcp.flags.fin == 1]
Null/Loopback
    Family: IP (2)
Internet Protocol Version 4, Src: 127.0.0.1, Dst: 127.0.0.1
    0100 .... = Version: 4
    .... 0101 = Header Length: 20 bytes (5)
    Differentiated Services Field: 0x00 (DSCP: CS0, ECN: Not-ECT)
        0000 00.. = Differentiated Services Codepoint: Default (0)
        .... ..00 = Explicit Congestion Notification: Not ECN-Capable Transport (0)
    Total Length: 64
    Identification: 0x64f5 (25845)
    Flags: 0x02 (Don't Fragment)
        0... .... = Reserved bit: Not set
        .1.. .... = Don't fragment: Set
        ..0. .... = More fragments: Not set
    Fragment offset: 0
    Time to live: 64
    Protocol: TCP (6)
    Header checksum: 0x0000 [validation disabled]
    [Header checksum status: Unverified]
    Source: 127.0.0.1
    Destination: 127.0.0.1
    [Source GeoIP: Unknown]
    [Destination GeoIP: Unknown]
Transmission Control Protocol, Src Port: 4296, Dst Port: 49813, Seq: 0, Ack: 1, Len: 0
    Source Port: 4296
    Destination Port: 49813
    [Stream index: 3]
    [TCP Segment Len: 0]
    Sequence number: 0    (relative sequence number)
    Acknowledgment number: 1    (relative ack number)
    Header Length: 44 bytes
    Flags: 0x012 (SYN, ACK)
        000. .... .... = Reserved: Not set
        ...0 .... .... = Nonce: Not set
        .... 0... .... = Congestion Window Reduced (CWR): Not set
        .... .0.. .... = ECN-Echo: Not set
        .... ..0. .... = Urgent: Not set
        .... ...1 .... = Acknowledgment: Set
        .... .... 0... = Push: Not set
        .... .... .0.. = Reset: Not set
        .... .... ..1. = Syn: Set
            [Expert Info (Chat/Sequence): Connection establish acknowledge (SYN+ACK): server port 4296]
                [Connection establish acknowledge (SYN+ACK): server port 4296]
                [Severity level: Chat]
                [Group: Sequence]
        .... .... ...0 = Fin: Not set
        [TCP Flags: ·······A··S·]
    Window size value: 65535
    [Calculated window size: 65535]
    Checksum: 0xfe34 [unverified]
    [Checksum Status: Unverified]
    Urgent pointer: 0
    Options: (24 bytes), Maximum segment size, No-Operation (NOP), Window scale, No-Operation (NOP), No-Operation (NOP), Timestamps, SACK permitted, End of Option List (EOL)
        Maximum segment size: 16344 bytes
            Kind: Maximum Segment Size (2)
            Length: 4
            MSS Value: 16344
        No-Operation (NOP)
            Type: 1
                0... .... = Copy on fragmentation: No
                .00. .... = Class: Control (0)
                ...0 0001 = Number: No-Operation (NOP) (1)
        Window scale: 5 (multiply by 32)
            Kind: Window Scale (3)
            Length: 3
            Shift count: 5
            [Multiplier: 32]
        No-Operation (NOP)
            Type: 1
                0... .... = Copy on fragmentation: No
                .00. .... = Class: Control (0)
                ...0 0001 = Number: No-Operation (NOP) (1)
        No-Operation (NOP)
            Type: 1
                0... .... = Copy on fragmentation: No
                .00. .... = Class: Control (0)
                ...0 0001 = Number: No-Operation (NOP) (1)
        Timestamps: TSval 680987802, TSecr 680987802
            Kind: Time Stamp Option (8)
            Length: 10
            Timestamp value: 680987802
            Timestamp echo reply: 680987802
        TCP SACK Permitted Option: True
            Kind: SACK Permitted (4)
            Length: 2
        End of Option List (EOL)
            Type: 0
                0... .... = Copy on fragmentation: No
                .00. .... = Class: Control (0)
                ...0 0000 = Number: End of Option List (EOL) (0)
    [SEQ/ACK analysis]
        [This is an ACK to the segment in frame: 52]
        [The RTT to ACK the segment was: 0.000157000 seconds]
        [iRTT: 0.000176000 seconds]

0000  02 00 00 00 45 00 00 40 64 f5 40 00 40 06 00 00   ....E..@d.@.@...
0010  7f 00 00 01 7f 00 00 01 10 c8 c2 95 75 f4 89 c2   ............u...
0020  a7 4d 11 15 b0 12 ff ff fe 34 00 00 02 04 3f d8   .M.......4....?.
0030  01 03 03 05 01 01 08 0a 28 97 0c 9a 28 97 0c 9a   ........(...(...
0040  04 02 00 00                                       ....

No.     Time                          Source                Destination           Protocol Length Info
     54 2017-04-12 10:04:27.680837    127.0.0.1             127.0.0.1             TCP      56     49813 → 4296 [ACK] Seq=1 Ack=1 Win=408288 Len=0 TSval=680987802 TSecr=680987802

Frame 54: 56 bytes on wire (448 bits), 56 bytes captured (448 bits) on interface 0
    Interface id: 0 (lo0)
    Encapsulation type: NULL/Loopback (15)
    Arrival Time: Apr 12, 2017 10:04:27.680837000 CEST
    [Time shift for this packet: 0.000000000 seconds]
    Epoch Time: 1491984267.680837000 seconds
    [Time delta from previous captured frame: 0.000019000 seconds]
    [Time delta from previous displayed frame: 0.000019000 seconds]
    [Time since reference or first frame: 96.130141000 seconds]
    Frame Number: 54
    Frame Length: 56 bytes (448 bits)
    Capture Length: 56 bytes (448 bits)
    [Frame is marked: True]
    [Frame is ignored: False]
    [Protocols in frame: null:ip:tcp]
    [Coloring Rule Name: TCP]
    [Coloring Rule String: tcp]
Null/Loopback
    Family: IP (2)
Internet Protocol Version 4, Src: 127.0.0.1, Dst: 127.0.0.1
    0100 .... = Version: 4
    .... 0101 = Header Length: 20 bytes (5)
    Differentiated Services Field: 0x00 (DSCP: CS0, ECN: Not-ECT)
        0000 00.. = Differentiated Services Codepoint: Default (0)
        .... ..00 = Explicit Congestion Notification: Not ECN-Capable Transport (0)
    Total Length: 52
    Identification: 0x7f55 (32597)
    Flags: 0x02 (Don't Fragment)
        0... .... = Reserved bit: Not set
        .1.. .... = Don't fragment: Set
        ..0. .... = More fragments: Not set
    Fragment offset: 0
    Time to live: 64
    Protocol: TCP (6)
    Header checksum: 0x0000 [validation disabled]
    [Header checksum status: Unverified]
    Source: 127.0.0.1
    Destination: 127.0.0.1
    [Source GeoIP: Unknown]
    [Destination GeoIP: Unknown]
Transmission Control Protocol, Src Port: 49813, Dst Port: 4296, Seq: 1, Ack: 1, Len: 0
    Source Port: 49813
    Destination Port: 4296
    [Stream index: 3]
    [TCP Segment Len: 0]
    Sequence number: 1    (relative sequence number)
    Acknowledgment number: 1    (relative ack number)
    Header Length: 32 bytes
    Flags: 0x010 (ACK)
        000. .... .... = Reserved: Not set
        ...0 .... .... = Nonce: Not set
        .... 0... .... = Congestion Window Reduced (CWR): Not set
        .... .0.. .... = ECN-Echo: Not set
        .... ..0. .... = Urgent: Not set
        .... ...1 .... = Acknowledgment: Set
        .... .... 0... = Push: Not set
        .... .... .0.. = Reset: Not set
        .... .... ..0. = Syn: Not set
        .... .... ...0 = Fin: Not set
        [TCP Flags: ·······A····]
    Window size value: 12759
    [Calculated window size: 408288]
    [Window size scaling factor: 32]
    Checksum: 0xfe28 [unverified]
    [Checksum Status: Unverified]
    Urgent pointer: 0
    Options: (12 bytes), No-Operation (NOP), No-Operation (NOP), Timestamps
        No-Operation (NOP)
            Type: 1
                0... .... = Copy on fragmentation: No
                .00. .... = Class: Control (0)
                ...0 0001 = Number: No-Operation (NOP) (1)
        No-Operation (NOP)
            Type: 1
                0... .... = Copy on fragmentation: No
                .00. .... = Class: Control (0)
                ...0 0001 = Number: No-Operation (NOP) (1)
        Timestamps: TSval 680987802, TSecr 680987802
            Kind: Time Stamp Option (8)
            Length: 10
            Timestamp value: 680987802
            Timestamp echo reply: 680987802
    [SEQ/ACK analysis]
        [This is an ACK to the segment in frame: 53]
        [The RTT to ACK the segment was: 0.000019000 seconds]
        [iRTT: 0.000176000 seconds]

0000  02 00 00 00 45 00 00 34 7f 55 40 00 40 06 00 00   ....E..4.U@.@...
0010  7f 00 00 01 7f 00 00 01 c2 95 10 c8 a7 4d 11 15   .............M..
0020  75 f4 89 c3 80 10 31 d7 fe 28 00 00 01 01 08 0a   u.....1..(......
0030  28 97 0c 9a 28 97 0c 9a                           (...(...

No.     Time                          Source                Destination           Protocol Length Info
     55 2017-04-12 10:04:27.680859    127.0.0.1             127.0.0.1             TCP      56     [TCP Window Update] 4296 → 49813 [ACK] Seq=1 Ack=1 Win=408288 Len=0 TSval=680987802 TSecr=680987802

Frame 55: 56 bytes on wire (448 bits), 56 bytes captured (448 bits) on interface 0
    Interface id: 0 (lo0)
    Encapsulation type: NULL/Loopback (15)
    Arrival Time: Apr 12, 2017 10:04:27.680859000 CEST
    [Time shift for this packet: 0.000000000 seconds]
    Epoch Time: 1491984267.680859000 seconds
    [Time delta from previous captured frame: 0.000022000 seconds]
    [Time delta from previous displayed frame: 0.000022000 seconds]
    [Time since reference or first frame: 96.130163000 seconds]
    Frame Number: 55
    Frame Length: 56 bytes (448 bits)
    Capture Length: 56 bytes (448 bits)
    [Frame is marked: True]
    [Frame is ignored: False]
    [Protocols in frame: null:ip:tcp]
    [Coloring Rule Name: TCP]
    [Coloring Rule String: tcp]
Null/Loopback
    Family: IP (2)
Internet Protocol Version 4, Src: 127.0.0.1, Dst: 127.0.0.1
    0100 .... = Version: 4
    .... 0101 = Header Length: 20 bytes (5)
    Differentiated Services Field: 0x00 (DSCP: CS0, ECN: Not-ECT)
        0000 00.. = Differentiated Services Codepoint: Default (0)
        .... ..00 = Explicit Congestion Notification: Not ECN-Capable Transport (0)
    Total Length: 52
    Identification: 0xa139 (41273)
    Flags: 0x02 (Don't Fragment)
        0... .... = Reserved bit: Not set
        .1.. .... = Don't fragment: Set
        ..0. .... = More fragments: Not set
    Fragment offset: 0
    Time to live: 64
    Protocol: TCP (6)
    Header checksum: 0x0000 [validation disabled]
    [Header checksum status: Unverified]
    Source: 127.0.0.1
    Destination: 127.0.0.1
    [Source GeoIP: Unknown]
    [Destination GeoIP: Unknown]
Transmission Control Protocol, Src Port: 4296, Dst Port: 49813, Seq: 1, Ack: 1, Len: 0
    Source Port: 4296
    Destination Port: 49813
    [Stream index: 3]
    [TCP Segment Len: 0]
    Sequence number: 1    (relative sequence number)
    Acknowledgment number: 1    (relative ack number)
    Header Length: 32 bytes
    Flags: 0x010 (ACK)
        000. .... .... = Reserved: Not set
        ...0 .... .... = Nonce: Not set
        .... 0... .... = Congestion Window Reduced (CWR): Not set
        .... .0.. .... = ECN-Echo: Not set
        .... ..0. .... = Urgent: Not set
        .... ...1 .... = Acknowledgment: Set
        .... .... 0... = Push: Not set
        .... .... .0.. = Reset: Not set
        .... .... ..0. = Syn: Not set
        .... .... ...0 = Fin: Not set
        [TCP Flags: ·······A····]
    Window size value: 12759
    [Calculated window size: 408288]
    [Window size scaling factor: 32]
    Checksum: 0xfe28 [unverified]
    [Checksum Status: Unverified]
    Urgent pointer: 0
    Options: (12 bytes), No-Operation (NOP), No-Operation (NOP), Timestamps
        No-Operation (NOP)
            Type: 1
                0... .... = Copy on fragmentation: No
                .00. .... = Class: Control (0)
                ...0 0001 = Number: No-Operation (NOP) (1)
        No-Operation (NOP)
            Type: 1
                0... .... = Copy on fragmentation: No
                .00. .... = Class: Control (0)
                ...0 0001 = Number: No-Operation (NOP) (1)
        Timestamps: TSval 680987802, TSecr 680987802
            Kind: Time Stamp Option (8)
            Length: 10
            Timestamp value: 680987802
            Timestamp echo reply: 680987802
    [SEQ/ACK analysis]
        [iRTT: 0.000176000 seconds]
        [TCP Analysis Flags]
            [Expert Info (Chat/Sequence): TCP window update]
                [TCP window update]
                [Severity level: Chat]
                [Group: Sequence]

0000  02 00 00 00 45 00 00 34 a1 39 40 00 40 06 00 00   ....E..4.9@.@...
0010  7f 00 00 01 7f 00 00 01 10 c8 c2 95 75 f4 89 c3   ............u...
0020  a7 4d 11 15 80 10 31 d7 fe 28 00 00 01 01 08 0a   .M....1..(......
0030  28 97 0c 9a 28 97 0c 9a                           (...(...

No.     Time                          Source                Destination           Protocol Length Info
     56 2017-04-12 10:04:27.688495    127.0.0.1             127.0.0.1             TCP      61     49813 → 4296 [PSH, ACK] Seq=1 Ack=1 Win=408288 Len=5 TSval=680987809 TSecr=680987802

Frame 56: 61 bytes on wire (488 bits), 61 bytes captured (488 bits) on interface 0
    Interface id: 0 (lo0)
    Encapsulation type: NULL/Loopback (15)
    Arrival Time: Apr 12, 2017 10:04:27.688495000 CEST
    [Time shift for this packet: 0.000000000 seconds]
    Epoch Time: 1491984267.688495000 seconds
    [Time delta from previous captured frame: 0.007636000 seconds]
    [Time delta from previous displayed frame: 0.007636000 seconds]
    [Time since reference or first frame: 96.137799000 seconds]
    Frame Number: 56
    Frame Length: 61 bytes (488 bits)
    Capture Length: 61 bytes (488 bits)
    [Frame is marked: True]
    [Frame is ignored: False]
    [Protocols in frame: null:ip:tcp:data]
    [Coloring Rule Name: TCP]
    [Coloring Rule String: tcp]
Null/Loopback
    Family: IP (2)
Internet Protocol Version 4, Src: 127.0.0.1, Dst: 127.0.0.1
    0100 .... = Version: 4
    .... 0101 = Header Length: 20 bytes (5)
    Differentiated Services Field: 0x00 (DSCP: CS0, ECN: Not-ECT)
        0000 00.. = Differentiated Services Codepoint: Default (0)
        .... ..00 = Explicit Congestion Notification: Not ECN-Capable Transport (0)
    Total Length: 57
    Identification: 0xb2b8 (45752)
    Flags: 0x02 (Don't Fragment)
        0... .... = Reserved bit: Not set
        .1.. .... = Don't fragment: Set
        ..0. .... = More fragments: Not set
    Fragment offset: 0
    Time to live: 64
    Protocol: TCP (6)
    Header checksum: 0x0000 [validation disabled]
    [Header checksum status: Unverified]
    Source: 127.0.0.1
    Destination: 127.0.0.1
    [Source GeoIP: Unknown]
    [Destination GeoIP: Unknown]
Transmission Control Protocol, Src Port: 49813, Dst Port: 4296, Seq: 1, Ack: 1, Len: 5
    Source Port: 49813
    Destination Port: 4296
    [Stream index: 3]
    [TCP Segment Len: 5]
    Sequence number: 1    (relative sequence number)
    [Next sequence number: 6    (relative sequence number)]
    Acknowledgment number: 1    (relative ack number)
    Header Length: 32 bytes
    Flags: 0x018 (PSH, ACK)
        000. .... .... = Reserved: Not set
        ...0 .... .... = Nonce: Not set
        .... 0... .... = Congestion Window Reduced (CWR): Not set
        .... .0.. .... = ECN-Echo: Not set
        .... ..0. .... = Urgent: Not set
        .... ...1 .... = Acknowledgment: Set
        .... .... 1... = Push: Set
        .... .... .0.. = Reset: Not set
        .... .... ..0. = Syn: Not set
        .... .... ...0 = Fin: Not set
        [TCP Flags: ·······AP···]
    Window size value: 12759
    [Calculated window size: 408288]
    [Window size scaling factor: 32]
    Checksum: 0xfe2d [unverified]
    [Checksum Status: Unverified]
    Urgent pointer: 0
    Options: (12 bytes), No-Operation (NOP), No-Operation (NOP), Timestamps
        No-Operation (NOP)
            Type: 1
                0... .... = Copy on fragmentation: No
                .00. .... = Class: Control (0)
                ...0 0001 = Number: No-Operation (NOP) (1)
        No-Operation (NOP)
            Type: 1
                0... .... = Copy on fragmentation: No
                .00. .... = Class: Control (0)
                ...0 0001 = Number: No-Operation (NOP) (1)
        Timestamps: TSval 680987809, TSecr 680987802
            Kind: Time Stamp Option (8)
            Length: 10
            Timestamp value: 680987809
            Timestamp echo reply: 680987802
    [SEQ/ACK analysis]
        [iRTT: 0.000176000 seconds]
        [Bytes in flight: 5]
        [Bytes sent since last PSH flag: 5]
Data (5 bytes)
    Data: 0000000100
    [Length: 5]

0000  02 00 00 00 45 00 00 39 b2 b8 40 00 40 06 00 00   ....E..9..@.@...
0010  7f 00 00 01 7f 00 00 01 c2 95 10 c8 a7 4d 11 15   .............M..
0020  75 f4 89 c3 80 18 31 d7 fe 2d 00 00 01 01 08 0a   u.....1..-......
0030  28 97 0c a1 28 97 0c 9a 00 00 00 01 00            (...(........

No.     Time                          Source                Destination           Protocol Length Info
     57 2017-04-12 10:04:27.688530    127.0.0.1             127.0.0.1             TCP      56     4296 → 49813 [ACK] Seq=1 Ack=6 Win=408288 Len=0 TSval=680987809 TSecr=680987809

Frame 57: 56 bytes on wire (448 bits), 56 bytes captured (448 bits) on interface 0
    Interface id: 0 (lo0)
    Encapsulation type: NULL/Loopback (15)
    Arrival Time: Apr 12, 2017 10:04:27.688530000 CEST
    [Time shift for this packet: 0.000000000 seconds]
    Epoch Time: 1491984267.688530000 seconds
    [Time delta from previous captured frame: 0.000035000 seconds]
    [Time delta from previous displayed frame: 0.000035000 seconds]
    [Time since reference or first frame: 96.137834000 seconds]
    Frame Number: 57
    Frame Length: 56 bytes (448 bits)
    Capture Length: 56 bytes (448 bits)
    [Frame is marked: True]
    [Frame is ignored: False]
    [Protocols in frame: null:ip:tcp]
    [Coloring Rule Name: TCP]
    [Coloring Rule String: tcp]
Null/Loopback
    Family: IP (2)
Internet Protocol Version 4, Src: 127.0.0.1, Dst: 127.0.0.1
    0100 .... = Version: 4
    .... 0101 = Header Length: 20 bytes (5)
    Differentiated Services Field: 0x00 (DSCP: CS0, ECN: Not-ECT)
        0000 00.. = Differentiated Services Codepoint: Default (0)
        .... ..00 = Explicit Congestion Notification: Not ECN-Capable Transport (0)
    Total Length: 52
    Identification: 0xea08 (59912)
    Flags: 0x02 (Don't Fragment)
        0... .... = Reserved bit: Not set
        .1.. .... = Don't fragment: Set
        ..0. .... = More fragments: Not set
    Fragment offset: 0
    Time to live: 64
    Protocol: TCP (6)
    Header checksum: 0x0000 [validation disabled]
    [Header checksum status: Unverified]
    Source: 127.0.0.1
    Destination: 127.0.0.1
    [Source GeoIP: Unknown]
    [Destination GeoIP: Unknown]
Transmission Control Protocol, Src Port: 4296, Dst Port: 49813, Seq: 1, Ack: 6, Len: 0
    Source Port: 4296
    Destination Port: 49813
    [Stream index: 3]
    [TCP Segment Len: 0]
    Sequence number: 1    (relative sequence number)
    Acknowledgment number: 6    (relative ack number)
    Header Length: 32 bytes
    Flags: 0x010 (ACK)
        000. .... .... = Reserved: Not set
        ...0 .... .... = Nonce: Not set
        .... 0... .... = Congestion Window Reduced (CWR): Not set
        .... .0.. .... = ECN-Echo: Not set
        .... ..0. .... = Urgent: Not set
        .... ...1 .... = Acknowledgment: Set
        .... .... 0... = Push: Not set
        .... .... .0.. = Reset: Not set
        .... .... ..0. = Syn: Not set
        .... .... ...0 = Fin: Not set
        [TCP Flags: ·······A····]
    Window size value: 12759
    [Calculated window size: 408288]
    [Window size scaling factor: 32]
    Checksum: 0xfe28 [unverified]
    [Checksum Status: Unverified]
    Urgent pointer: 0
    Options: (12 bytes), No-Operation (NOP), No-Operation (NOP), Timestamps
        No-Operation (NOP)
            Type: 1
                0... .... = Copy on fragmentation: No
                .00. .... = Class: Control (0)
                ...0 0001 = Number: No-Operation (NOP) (1)
        No-Operation (NOP)
            Type: 1
                0... .... = Copy on fragmentation: No
                .00. .... = Class: Control (0)
                ...0 0001 = Number: No-Operation (NOP) (1)
        Timestamps: TSval 680987809, TSecr 680987809
            Kind: Time Stamp Option (8)
            Length: 10
            Timestamp value: 680987809
            Timestamp echo reply: 680987809
    [SEQ/ACK analysis]
        [This is an ACK to the segment in frame: 56]
        [The RTT to ACK the segment was: 0.000035000 seconds]
        [iRTT: 0.000176000 seconds]

0000  02 00 00 00 45 00 00 34 ea 08 40 00 40 06 00 00   ....E..4..@.@...
0010  7f 00 00 01 7f 00 00 01 10 c8 c2 95 75 f4 89 c3   ............u...
0020  a7 4d 11 1a 80 10 31 d7 fe 28 00 00 01 01 08 0a   .M....1..(......
0030  28 97 0c a1 28 97 0c a1                           (...(...

No.     Time                          Source                Destination           Protocol Length Info
     58 2017-04-12 10:04:27.689233    127.0.0.1             127.0.0.1             TCP      70     49813 → 4296 [PSH, ACK] Seq=6 Ack=1 Win=408288 Len=14 TSval=680987809 TSecr=680987809

Frame 58: 70 bytes on wire (560 bits), 70 bytes captured (560 bits) on interface 0
    Interface id: 0 (lo0)
    Encapsulation type: NULL/Loopback (15)
    Arrival Time: Apr 12, 2017 10:04:27.689233000 CEST
    [Time shift for this packet: 0.000000000 seconds]
    Epoch Time: 1491984267.689233000 seconds
    [Time delta from previous captured frame: 0.000703000 seconds]
    [Time delta from previous displayed frame: 0.000703000 seconds]
    [Time since reference or first frame: 96.138537000 seconds]
    Frame Number: 58
    Frame Length: 70 bytes (560 bits)
    Capture Length: 70 bytes (560 bits)
    [Frame is marked: True]
    [Frame is ignored: False]
    [Protocols in frame: null:ip:tcp:data]
    [Coloring Rule Name: TCP]
    [Coloring Rule String: tcp]
Null/Loopback
    Family: IP (2)
Internet Protocol Version 4, Src: 127.0.0.1, Dst: 127.0.0.1
    0100 .... = Version: 4
    .... 0101 = Header Length: 20 bytes (5)
    Differentiated Services Field: 0x00 (DSCP: CS0, ECN: Not-ECT)
        0000 00.. = Differentiated Services Codepoint: Default (0)
        .... ..00 = Explicit Congestion Notification: Not ECN-Capable Transport (0)
    Total Length: 66
    Identification: 0x4181 (16769)
    Flags: 0x02 (Don't Fragment)
        0... .... = Reserved bit: Not set
        .1.. .... = Don't fragment: Set
        ..0. .... = More fragments: Not set
    Fragment offset: 0
    Time to live: 64
    Protocol: TCP (6)
    Header checksum: 0x0000 [validation disabled]
    [Header checksum status: Unverified]
    Source: 127.0.0.1
    Destination: 127.0.0.1
    [Source GeoIP: Unknown]
    [Destination GeoIP: Unknown]
Transmission Control Protocol, Src Port: 49813, Dst Port: 4296, Seq: 6, Ack: 1, Len: 14
    Source Port: 49813
    Destination Port: 4296
    [Stream index: 3]
    [TCP Segment Len: 14]
    Sequence number: 6    (relative sequence number)
    [Next sequence number: 20    (relative sequence number)]
    Acknowledgment number: 1    (relative ack number)
    Header Length: 32 bytes
    Flags: 0x018 (PSH, ACK)
        000. .... .... = Reserved: Not set
        ...0 .... .... = Nonce: Not set
        .... 0... .... = Congestion Window Reduced (CWR): Not set
        .... .0.. .... = ECN-Echo: Not set
        .... ..0. .... = Urgent: Not set
        .... ...1 .... = Acknowledgment: Set
        .... .... 1... = Push: Set
        .... .... .0.. = Reset: Not set
        .... .... ..0. = Syn: Not set
        .... .... ...0 = Fin: Not set
        [TCP Flags: ·······AP···]
    Window size value: 12759
    [Calculated window size: 408288]
    [Window size scaling factor: 32]
    Checksum: 0xfe36 [unverified]
    [Checksum Status: Unverified]
    Urgent pointer: 0
    Options: (12 bytes), No-Operation (NOP), No-Operation (NOP), Timestamps
        No-Operation (NOP)
            Type: 1
                0... .... = Copy on fragmentation: No
                .00. .... = Class: Control (0)
                ...0 0001 = Number: No-Operation (NOP) (1)
        No-Operation (NOP)
            Type: 1
                0... .... = Copy on fragmentation: No
                .00. .... = Class: Control (0)
                ...0 0001 = Number: No-Operation (NOP) (1)
        Timestamps: TSval 680987809, TSecr 680987809
            Kind: Time Stamp Option (8)
            Length: 10
            Timestamp value: 680987809
            Timestamp echo reply: 680987809
    [SEQ/ACK analysis]
        [iRTT: 0.000176000 seconds]
        [Bytes in flight: 14]
        [Bytes sent since last PSH flag: 14]
Data (14 bytes)
    Data: 0000000a00010203040506070809
    [Length: 14]

0000  02 00 00 00 45 00 00 42 41 81 40 00 40 06 00 00   ....E..BA.@.@...
0010  7f 00 00 01 7f 00 00 01 c2 95 10 c8 a7 4d 11 1a   .............M..
0020  75 f4 89 c3 80 18 31 d7 fe 36 00 00 01 01 08 0a   u.....1..6......
0030  28 97 0c a1 28 97 0c a1 00 00 00 0a 00 01 02 03   (...(...........
0040  04 05 06 07 08 09                                 ......

No.     Time                          Source                Destination           Protocol Length Info
     59 2017-04-12 10:04:27.689257    127.0.0.1             127.0.0.1             TCP      56     4296 → 49813 [ACK] Seq=1 Ack=20 Win=408256 Len=0 TSval=680987809 TSecr=680987809

Frame 59: 56 bytes on wire (448 bits), 56 bytes captured (448 bits) on interface 0
    Interface id: 0 (lo0)
    Encapsulation type: NULL/Loopback (15)
    Arrival Time: Apr 12, 2017 10:04:27.689257000 CEST
    [Time shift for this packet: 0.000000000 seconds]
    Epoch Time: 1491984267.689257000 seconds
    [Time delta from previous captured frame: 0.000024000 seconds]
    [Time delta from previous displayed frame: 0.000024000 seconds]
    [Time since reference or first frame: 96.138561000 seconds]
    Frame Number: 59
    Frame Length: 56 bytes (448 bits)
    Capture Length: 56 bytes (448 bits)
    [Frame is marked: True]
    [Frame is ignored: False]
    [Protocols in frame: null:ip:tcp]
    [Coloring Rule Name: TCP]
    [Coloring Rule String: tcp]
Null/Loopback
    Family: IP (2)
Internet Protocol Version 4, Src: 127.0.0.1, Dst: 127.0.0.1
    0100 .... = Version: 4
    .... 0101 = Header Length: 20 bytes (5)
    Differentiated Services Field: 0x00 (DSCP: CS0, ECN: Not-ECT)
        0000 00.. = Differentiated Services Codepoint: Default (0)
        .... ..00 = Explicit Congestion Notification: Not ECN-Capable Transport (0)
    Total Length: 52
    Identification: 0x7aa2 (31394)
    Flags: 0x02 (Don't Fragment)
        0... .... = Reserved bit: Not set
        .1.. .... = Don't fragment: Set
        ..0. .... = More fragments: Not set
    Fragment offset: 0
    Time to live: 64
    Protocol: TCP (6)
    Header checksum: 0x0000 [validation disabled]
    [Header checksum status: Unverified]
    Source: 127.0.0.1
    Destination: 127.0.0.1
    [Source GeoIP: Unknown]
    [Destination GeoIP: Unknown]
Transmission Control Protocol, Src Port: 4296, Dst Port: 49813, Seq: 1, Ack: 20, Len: 0
    Source Port: 4296
    Destination Port: 49813
    [Stream index: 3]
    [TCP Segment Len: 0]
    Sequence number: 1    (relative sequence number)
    Acknowledgment number: 20    (relative ack number)
    Header Length: 32 bytes
    Flags: 0x010 (ACK)
        000. .... .... = Reserved: Not set
        ...0 .... .... = Nonce: Not set
        .... 0... .... = Congestion Window Reduced (CWR): Not set
        .... .0.. .... = ECN-Echo: Not set
        .... ..0. .... = Urgent: Not set
        .... ...1 .... = Acknowledgment: Set
        .... .... 0... = Push: Not set
        .... .... .0.. = Reset: Not set
        .... .... ..0. = Syn: Not set
        .... .... ...0 = Fin: Not set
        [TCP Flags: ·······A····]
    Window size value: 12758
    [Calculated window size: 408256]
    [Window size scaling factor: 32]
    Checksum: 0xfe28 [unverified]
    [Checksum Status: Unverified]
    Urgent pointer: 0
    Options: (12 bytes), No-Operation (NOP), No-Operation (NOP), Timestamps
        No-Operation (NOP)
            Type: 1
                0... .... = Copy on fragmentation: No
                .00. .... = Class: Control (0)
                ...0 0001 = Number: No-Operation (NOP) (1)
        No-Operation (NOP)
            Type: 1
                0... .... = Copy on fragmentation: No
                .00. .... = Class: Control (0)
                ...0 0001 = Number: No-Operation (NOP) (1)
        Timestamps: TSval 680987809, TSecr 680987809
            Kind: Time Stamp Option (8)
            Length: 10
            Timestamp value: 680987809
            Timestamp echo reply: 680987809
    [SEQ/ACK analysis]
        [This is an ACK to the segment in frame: 58]
        [The RTT to ACK the segment was: 0.000024000 seconds]
        [iRTT: 0.000176000 seconds]

0000  02 00 00 00 45 00 00 34 7a a2 40 00 40 06 00 00   ....E..4z.@.@...
0010  7f 00 00 01 7f 00 00 01 10 c8 c2 95 75 f4 89 c3   ............u...
0020  a7 4d 11 28 80 10 31 d6 fe 28 00 00 01 01 08 0a   .M.(..1..(......
0030  28 97 0c a1 28 97 0c a1                           (...(...

No.     Time                          Source                Destination           Protocol Length Info
     60 2017-04-12 10:04:27.689977    127.0.0.1             127.0.0.1             TCP      70     4296 → 49813 [PSH, ACK] Seq=1 Ack=20 Win=408256 Len=14 TSval=680987810 TSecr=680987809

Frame 60: 70 bytes on wire (560 bits), 70 bytes captured (560 bits) on interface 0
    Interface id: 0 (lo0)
    Encapsulation type: NULL/Loopback (15)
    Arrival Time: Apr 12, 2017 10:04:27.689977000 CEST
    [Time shift for this packet: 0.000000000 seconds]
    Epoch Time: 1491984267.689977000 seconds
    [Time delta from previous captured frame: 0.000720000 seconds]
    [Time delta from previous displayed frame: 0.000720000 seconds]
    [Time since reference or first frame: 96.139281000 seconds]
    Frame Number: 60
    Frame Length: 70 bytes (560 bits)
    Capture Length: 70 bytes (560 bits)
    [Frame is marked: True]
    [Frame is ignored: False]
    [Protocols in frame: null:ip:tcp:data]
    [Coloring Rule Name: TCP]
    [Coloring Rule String: tcp]
Null/Loopback
    Family: IP (2)
Internet Protocol Version 4, Src: 127.0.0.1, Dst: 127.0.0.1
    0100 .... = Version: 4
    .... 0101 = Header Length: 20 bytes (5)
    Differentiated Services Field: 0x00 (DSCP: CS0, ECN: Not-ECT)
        0000 00.. = Differentiated Services Codepoint: Default (0)
        .... ..00 = Explicit Congestion Notification: Not ECN-Capable Transport (0)
    Total Length: 66
    Identification: 0xd712 (55058)
    Flags: 0x02 (Don't Fragment)
        0... .... = Reserved bit: Not set
        .1.. .... = Don't fragment: Set
        ..0. .... = More fragments: Not set
    Fragment offset: 0
    Time to live: 64
    Protocol: TCP (6)
    Header checksum: 0x0000 [validation disabled]
    [Header checksum status: Unverified]
    Source: 127.0.0.1
    Destination: 127.0.0.1
    [Source GeoIP: Unknown]
    [Destination GeoIP: Unknown]
Transmission Control Protocol, Src Port: 4296, Dst Port: 49813, Seq: 1, Ack: 20, Len: 14
    Source Port: 4296
    Destination Port: 49813
    [Stream index: 3]
    [TCP Segment Len: 14]
    Sequence number: 1    (relative sequence number)
    [Next sequence number: 15    (relative sequence number)]
    Acknowledgment number: 20    (relative ack number)
    Header Length: 32 bytes
    Flags: 0x018 (PSH, ACK)
        000. .... .... = Reserved: Not set
        ...0 .... .... = Nonce: Not set
        .... 0... .... = Congestion Window Reduced (CWR): Not set
        .... .0.. .... = ECN-Echo: Not set
        .... ..0. .... = Urgent: Not set
        .... ...1 .... = Acknowledgment: Set
        .... .... 1... = Push: Set
        .... .... .0.. = Reset: Not set
        .... .... ..0. = Syn: Not set
        .... .... ...0 = Fin: Not set
        [TCP Flags: ·······AP···]
    Window size value: 12758
    [Calculated window size: 408256]
    [Window size scaling factor: 32]
    Checksum: 0xfe36 [unverified]
    [Checksum Status: Unverified]
    Urgent pointer: 0
    Options: (12 bytes), No-Operation (NOP), No-Operation (NOP), Timestamps
        No-Operation (NOP)
            Type: 1
                0... .... = Copy on fragmentation: No
                .00. .... = Class: Control (0)
                ...0 0001 = Number: No-Operation (NOP) (1)
        No-Operation (NOP)
            Type: 1
                0... .... = Copy on fragmentation: No
                .00. .... = Class: Control (0)
                ...0 0001 = Number: No-Operation (NOP) (1)
        Timestamps: TSval 680987810, TSecr 680987809
            Kind: Time Stamp Option (8)
            Length: 10
            Timestamp value: 680987810
            Timestamp echo reply: 680987809
    [SEQ/ACK analysis]
        [iRTT: 0.000176000 seconds]
        [Bytes in flight: 14]
        [Bytes sent since last PSH flag: 14]
Data (14 bytes)
    Data: 0000000a00010203040506070809
    [Length: 14]

0000  02 00 00 00 45 00 00 42 d7 12 40 00 40 06 00 00   ....E..B..@.@...
0010  7f 00 00 01 7f 00 00 01 10 c8 c2 95 75 f4 89 c3   ............u...
0020  a7 4d 11 28 80 18 31 d6 fe 36 00 00 01 01 08 0a   .M.(..1..6......
0030  28 97 0c a2 28 97 0c a1 00 00 00 0a 00 01 02 03   (...(...........
0040  04 05 06 07 08 09                                 ......

No.     Time                          Source                Destination           Protocol Length Info
     61 2017-04-12 10:04:27.690003    127.0.0.1             127.0.0.1             TCP      56     49813 → 4296 [ACK] Seq=20 Ack=15 Win=408256 Len=0 TSval=680987810 TSecr=680987810

Frame 61: 56 bytes on wire (448 bits), 56 bytes captured (448 bits) on interface 0
    Interface id: 0 (lo0)
    Encapsulation type: NULL/Loopback (15)
    Arrival Time: Apr 12, 2017 10:04:27.690003000 CEST
    [Time shift for this packet: 0.000000000 seconds]
    Epoch Time: 1491984267.690003000 seconds
